isStance,sentence
,"With the values of putting consumers first and actions before words, and achieving win-win outcomes and excellence, we pursue sustainability in five key areas quality innovation; shared industry prosperity; ecological cycle; people-oriented responsibility; love and care."
,"In June 2021, the inauguration ceremony of the mother- and-baby room phase II project sponsored by China Feihe and Women of China, a magazine for women, was held in Beijing under the theme of Small space, full of love."
,"Case China Well-off Milk Campaign in Anhui to help poor students and promote rural revitalization Case Feihe Student and Education Assistance Program for Poverty Alleviation in Yuannan again to protect teenagers with Feihe's responsibilityOur Rural Revitalization Contribution Plan, a part of China's Well-off Milk Campaign themed Warm sunshine to spread boundless love was held in Guanzhuang Town, Qianshan City, Anhui Province on October 13, 2021, 2021."
,"Our Feihe Student and Education Assistance Program for Poverty Alleviation, a part of China's Well-off Milk Campaign themed Warm sunshine to spread boundless love was held in Jiahe Township, Jiangcheng County, Pu'er, Yunnan Province on June 22, 2021."
,"From 2017 to 2021, with the theme of Warm sunshine to spread boundless love, the program spread love to primary and secondary school students all over the country."
