isStance,sentence
,"The crisis management team defuses risks and, should crises occur, we examine the damage they cause and draw lessons to avoid them in the future."
,"In terms of an internal audit system, our Audit System of Feihe Dairy specifies that directors, senior managers, functional departments, wholly-owned or holding companies and joint-stock companies with significant influence should be audited and supervised, and sets punishments for violations at different levels."
,"The use of veterinary drugs should be approved and purchased according to the regulations, and diagnosis and treatment, dosage and inventory are registered to ensure accurate use."
,"We updated the Information Confidentiality Management System in 2021, which specified how users' personal information should be protected and how departments take their responsibilities."
,"Our departments promoted environmental protection to employees at morning meetings, with an emphasis that discarded electronic products should not be discarded at will."
